{
    "sdf_version": "0.1",
    "document_id": "f6a7b8c9-d0e1-4f2a-3b4c-5d6e7f8a9b0c",
    "issuer": "Universitätsspital Basel",
    "issuer_id": "CH-BS-USB-0001",
    "created_at": "2026-03-15T07:00:00+01:00",
    "document_type": "gov_health_report",
    "document_version": "1.0.0",
    "recipient": "Swiss Federal Office of Public Health",
    "recipient_id": "CHE-FOPH",
    "schema_id": "https://etapsky.github.io/sdf/schemas/gov-health-report/v0.1.json",
    "signature_algorithm": null,
    "expires_at": "2027-03-15T23:59:59Z",
    "tags": ["notifiable-disease", "respiratory", "basel", "q1-2026"]
  }