{
    "sdf_version": "0.1",
    "document_id": "f47ac10b-58cc-4372-a567-0e02b2c3d479",
    "issuer": "Acme Supplies GmbH",
    "issuer_id": "DE123456789",
    "created_at": "2026-03-15T14:30:00+01:00",
    "document_type": "invoice",
    "document_version": "1.0.0",
    "recipient": "Global Logistics AG",
    "recipient_id": "CH-123.456.789",
    "schema_id": "https://etapsky.github.io/sdf/schemas/invoice/v0.1.json",
    "signature_algorithm": null,
    "tags": ["q1-2026", "key-account"]
  }