{
    "sdf_version": "0.1",
    "document_id": "b2c3d4e5-f6a7-4b8c-9d0e-1f2a3b4c5d6e",
    "issuer": "Global Logistics AG",
    "issuer_id": "CH-123.456.789",
    "created_at": "2026-03-01T10:00:00+01:00",
    "document_type": "purchase_order",
    "document_version": "1.0.0",
    "recipient": "Acme Supplies GmbH",
    "recipient_id": "DE123456789",
    "schema_id": "https://etapsky.github.io/sdf/schemas/purchase-order/v0.1.json",
    "signature_algorithm": null,
    "tags": ["q1-2026", "maintenance"]
  }