{
    "sdf_version": "0.1",
    "document_id": "a1b2c3d4-e5f6-4a7b-8c9d-0e1f2a3b4c5d",
    "issuer": "Nordic Energy Trading AS",
    "issuer_id": "NO-987654321",
    "created_at": "2026-03-10T09:00:00+01:00",
    "document_type": "nomination",
    "document_version": "1.0.0",
    "recipient": "Baltic Ship Agents Ltd",
    "recipient_id": "EE-123456789",
    "schema_id": "https://etapsky.github.io/sdf/schemas/nomination/v0.1.json",
    "signature_algorithm": null,
    "tags": ["q1-2026", "crude-oil", "rotterdam"]
  }