{
    "sdf_version": "0.1",
    "document_id": "c3d4e5f6-a7b8-4c9d-0e1f-2a3b4c5d6e7f",
    "issuer": "Global Logistics AG",
    "issuer_id": "CHE-123.456.789",
    "created_at": "2026-03-31T23:59:00+02:00",
    "document_type": "gov_tax_declaration",
    "document_version": "1.0.0",
    "recipient": "Swiss Federal Tax Administration",
    "recipient_id": "CHE-SFTA",
    "schema_id": "https://etapsky.github.io/sdf/schemas/gov-tax-declaration/v0.1.json",
    "signature_algorithm": null,
    "expires_at": "2026-12-31T23:59:59Z",
    "tags": ["tax-year-2025", "corporate-income-tax", "switzerland"]
  }